user_input,retrieved_contexts,response,reference,faithfulness,answer_relevancy,context_precision,context_recall
¿Qué es el factor de descuento?,"[""útil es una acción en ganar una recompensa a futuro (Shyalika, 2019). Es así que el Q-\nlearning estima la función  que es el valor esperado de hacer una acción 'a' en\nun estado 's' para estimar la política óptima y la ecuación de actualización de los\nvalores  es la siguiente:\nDonde:\n = recompensa obtenida en ese estado dada una acción.\n = factor de descuento para el estado futuro (al que se transitará), su valor es fijo\ny puede tomar el rango de valores de [0,1].\n = parámetro de aprendizaje, no es fijo ya que al inicio comienza en 1 y con cada\niteración irá disminuyendo su valor hasta alcanzar el valor de 0 o un límite inferior\ndefinido de antemano (ej. 0.01).\n = valor Q del estado actual dada la acción a.\n = máxima futura recompensa esperada del estado nuevo al que se\ntransitará.\nComo se puede apreciar en la ecuación anterior, el Q-learning usa el método de\ndiferencias temporales para la actualización o estimación de los valores Q, ya que sólo"", '1. Se especifica la estructura del entorno con una cuadrícula de  (en este caso\n) con el comando desc = [""SFFF"", ""FHFF"", ""FFFH"", ""FFFG""] (se pueden variar\nel orden de sus elementos), donde:\nS = posición inicial del agente (start)\nF = hielo (frozen)\nH = hoyo\nG = meta (goal)\n2. El comando is_slippery=True implica que el suelo está resbaloso y hace que el\nagente se mueva con una probabilidad de 1/3 a la casilla deseada y con un 1/3 de\nprobabilidad a las casillas perpendiculares a la acción deseada. Si es False el\nagente se mueve a la casilla deseada siempre.\n3. El comando render_mode=""human"" sirve para visualizar al entorno gráficamente,\nsi es igual a ""ansi"" entonces los valores de las acciones se guardan en un string\nque contiene una representación de texto de estilo terminal para cada paso\ntemporal, aunque sólo se visualiza este string si es solicitado.\n#creación del ambiente virtual con la paquetería gymnasium\nenv=gym.make(""FrozenLake-v1"",', ""estado posible y las columnas las acciones posibles en cada estado. Esta se inicializa\ncon todos sus valores en cero y conforme el agente aprenda actualizará los valores de\ncada entrada.\nQ_table = np.zeros((env.observation_space.n,env.action_space.n ))\n#para visualizar la Q-table como un data frame\ndf=pd.DataFrame(data=Q_table, columns=['Izquierda', 'Abajo', 'Derecha', 'Arriba'])\ndf.index = [i+1 for i in range(len(df))]\ndf.columns.name = 'Estado'\ndf\nIn [5]:\nIn [6]:\nOut[6]:\nIn [7]:\nOut[7]:\nIn [8]:""]","**Resumen**: El factor de descuento es un parámetro en Q-Learning que controla la importancia de las recompensas futuras.

**Respuesta Principal**: En el contexto de Q-Learning, el factor de descuento (γ) es un parámetro que se utiliza para ponderar la importancia de las recompensas futuras en la ecuación de actualización de los valores Q. Su valor se encuentra en el rango de [0,1], lo que significa que cuanto más cercano a 0 sea el valor de γ, menos importancia se le dará a las recompensas futuras, y cuanto más cercano a 1 sea el valor de γ, más importancia se le dará a las recompensas futuras.

En otras palabras, el factor de descuento controla la tasa a la que el agente aprende de las recompensas futuras. Un valor alto de γ indica que el agente valoriza más las recompensas futuras y está dispuesto a esperar para obtener una recompensa mayor, mientras que un valor bajo de γ indica que el agente se centra más en las recompensas inmediatas.

**Detalles Adicionales**: Es importante destacar que el factor de descuento es un parámetro que se configura antes de iniciar el entrenamiento del agente y puede afectar significativamente el desempeño del agente en diferentes entornos.

**Conclusión**: En resumen, el factor de descuento es un parámetro fundamental en Q-Learning que controla la importancia de las recompensas futuras y puede afectar la estrategia del agente en diferentes entornos.","El factor de descuento (γ) determina la importancia de las recompensas futuras versus las inmediatas. Un valor cercano a 0 hace que el agente sea miope (solo considera recompensas inmediatas), mientras que un valor cercano a 1 hace que considere igualmente las recompensas a largo plazo. Típicamente γ está entre 0.9 y 0.99.",0.6428571428571429,0.804352928280955,0.9999999999,0.6666666666666666
¿Cuáles son las ventajas del Q-Learning?,"['1) Modificar el código en la etapa de entrenamiento para que corra \nsólo 20 episodio (n_episodes = 20) y correr todo el código que \nsigue. ¿Qué cambios observas en la tabla Q? ¿En la etapa de prueba \no testing el agente sí llega a la meta o qué pasa?\n2) ¿Cuáles son las diferencias en la conducta del agente de \nacciones aleatorias y el agente con el algoritmo de Q-learning?\nReferencias:\nAggarwal, R. (s. f.). Q-learning - Reinforcement Learning. Recuperado el 15 de\ndiciembre de 2022. https://miet.ac.in/assets/uploads/cs/Q%20Learning.pdf\nBrooker, R. (2020). OpenAI Gym: CartPole-v1 - Q-Learning [Youtube].\nhttps://www.youtube.com/watch?v=JNKvJEzuNsc&t=227s\nJang, B. Kim, M. Harerimana, G. y Kim, J.W. (2019). ""Q-Learning Algorithms: A\nComprehensive Classification and Applications,"". IEEE Access, vol. 7,133653-\n133667, doi: 10.1109/ACCESS.2019.2941229\nMatiisen, T. (s. f.). Q-learning [Presentación]. Recuperado el 15 de diciembre de', ""Visualización del Q-table después del aprendizaje\nRecordemos que las filas representan los 16 diferentes estados y las columnas las 4\ndiferentes acciones. El hecho de la tabla tenga valores diferentes de 0 significa que el\nagente aprendió algo. En cada fila la entrada con un valor más cercano a uno\nrepresenta la acción más óptima, porque se elige el argumento máximo del estado\ncuando se explota. Las filas con sólo ceros es porque probablemente el agente nunca\npasó por ese estado o porque es la meta.\nfrom seaborn import heatmap\ndatos = pd.DataFrame(data=Q_table, columns=['Izquierda', 'Abajo', 'Derecha', 'Arrib\nheatmap(datos, cmap='Blues', annot=True, square=False)\nplt.ylabel('Estados')\nplt.show()\nIn [15]:"", ""útil es una acción en ganar una recompensa a futuro (Shyalika, 2019). Es así que el Q-\nlearning estima la función  que es el valor esperado de hacer una acción 'a' en\nun estado 's' para estimar la política óptima y la ecuación de actualización de los\nvalores  es la siguiente:\nDonde:\n = recompensa obtenida en ese estado dada una acción.\n = factor de descuento para el estado futuro (al que se transitará), su valor es fijo\ny puede tomar el rango de valores de [0,1].\n = parámetro de aprendizaje, no es fijo ya que al inicio comienza en 1 y con cada\niteración irá disminuyendo su valor hasta alcanzar el valor de 0 o un límite inferior\ndefinido de antemano (ej. 0.01).\n = valor Q del estado actual dada la acción a.\n = máxima futura recompensa esperada del estado nuevo al que se\ntransitará.\nComo se puede apreciar en la ecuación anterior, el Q-learning usa el método de\ndiferencias temporales para la actualización o estimación de los valores Q, ya que sólo""]","**Resumen**: El Q-Learning presenta varias ventajas, como la capacidad de aprender de la experiencia, converger a la política óptima y ser aplicable a problemas complejos.

**Respuesta Principal**: El Q-Learning es un algoritmo de aprendizaje por refuerzo que ofrece varias ventajas. En primer lugar, el Q-Learning permite al agente aprender de la experiencia, lo que significa que puede adaptarse a entornos cambiantes y mejorar su desempeño con el tiempo. Además, el Q-Learning converge a la política óptima, lo que garantiza que el agente tome las decisiones más adecuadas para maximizar la recompensa.

Otra ventaja del Q-Learning es su capacidad para manejar problemas complejos con un gran número de estados y acciones. Esto se debe a que el algoritmo utiliza una tabla Q para almacenar los valores de las acciones en cada estado, lo que permite al agente tomar decisiones informadas.

Además, el Q-Learning es un algoritmo modelo-free, lo que significa que no requiere un modelo del entorno para funcionar. Esto lo hace más flexible y fácil de implementar en comparación con otros algoritmos de aprendizaje por refuerzo.

**Detalles Adicionales**: Es importante destacar que el Q-Learning también tiene algunas limitaciones, como la necesidad de un gran número de episodios para converger a la política óptima y la posibilidad de sobreajuste. Sin embargo, estas limitaciones pueden ser mitigadas mediante la selección adecuada de los parámetros del algoritmo y la implementación de técnicas de exploración y explotación adecuadas.

**Conclusión**: En resumen, el Q-Learning es un algoritmo de aprendizaje por refuerzo poderoso que ofrece varias ventajas, como la capacidad de aprender de la experiencia, converger a la política óptima y ser aplicable a problemas complejos. Sin embargo, es importante considerar sus limitaciones y implementar técnicas adecuadas para mitigarlas.","Las ventajas del Q-Learning incluyen: no requiere modelo del entorno, garantiza convergencia a la política óptima bajo ciertas condiciones, es simple de implementar, funciona con espacios de estados y acciones discretos, y puede manejar problemas estocásticos.",0.8636363636363636,0.9093513592228244,0.0,0.0
¿En qué problemas se aplica Q-Learning?,"['1) Modificar el código en la etapa de entrenamiento para que corra \nsólo 20 episodio (n_episodes = 20) y correr todo el código que \nsigue. ¿Qué cambios observas en la tabla Q? ¿En la etapa de prueba \no testing el agente sí llega a la meta o qué pasa?\n2) ¿Cuáles son las diferencias en la conducta del agente de \nacciones aleatorias y el agente con el algoritmo de Q-learning?\nReferencias:\nAggarwal, R. (s. f.). Q-learning - Reinforcement Learning. Recuperado el 15 de\ndiciembre de 2022. https://miet.ac.in/assets/uploads/cs/Q%20Learning.pdf\nBrooker, R. (2020). OpenAI Gym: CartPole-v1 - Q-Learning [Youtube].\nhttps://www.youtube.com/watch?v=JNKvJEzuNsc&t=227s\nJang, B. Kim, M. Harerimana, G. y Kim, J.W. (2019). ""Q-Learning Algorithms: A\nComprehensive Classification and Applications,"". IEEE Access, vol. 7,133653-\n133667, doi: 10.1109/ACCESS.2019.2941229\nMatiisen, T. (s. f.). Q-learning [Presentación]. Recuperado el 15 de diciembre de', ""útil es una acción en ganar una recompensa a futuro (Shyalika, 2019). Es así que el Q-\nlearning estima la función  que es el valor esperado de hacer una acción 'a' en\nun estado 's' para estimar la política óptima y la ecuación de actualización de los\nvalores  es la siguiente:\nDonde:\n = recompensa obtenida en ese estado dada una acción.\n = factor de descuento para el estado futuro (al que se transitará), su valor es fijo\ny puede tomar el rango de valores de [0,1].\n = parámetro de aprendizaje, no es fijo ya que al inicio comienza en 1 y con cada\niteración irá disminuyendo su valor hasta alcanzar el valor de 0 o un límite inferior\ndefinido de antemano (ej. 0.01).\n = valor Q del estado actual dada la acción a.\n = máxima futura recompensa esperada del estado nuevo al que se\ntransitará.\nComo se puede apreciar en la ecuación anterior, el Q-learning usa el método de\ndiferencias temporales para la actualización o estimación de los valores Q, ya que sólo"", ""estado posible y las columnas las acciones posibles en cada estado. Esta se inicializa\ncon todos sus valores en cero y conforme el agente aprenda actualizará los valores de\ncada entrada.\nQ_table = np.zeros((env.observation_space.n,env.action_space.n ))\n#para visualizar la Q-table como un data frame\ndf=pd.DataFrame(data=Q_table, columns=['Izquierda', 'Abajo', 'Derecha', 'Arriba'])\ndf.index = [i+1 for i in range(len(df))]\ndf.columns.name = 'Estado'\ndf\nIn [5]:\nIn [6]:\nOut[6]:\nIn [7]:\nOut[7]:\nIn [8]:""]","**Resumen**: Q-Learning se aplica a problemas de aprendizaje por refuerzo, donde un agente interactúa con un entorno y busca maximizar una recompensa.

**Respuesta Principal**: Q-Learning es un algoritmo de aprendizaje por refuerzo que se aplica a una variedad de problemas, como:

* Control de sistemas dinámicos, como robots o vehículos autónomos
* Juegos, como cartpole o Atari
* Optimización de procesos, como la programación de tareas o la gestión de inventarios
* Problemas de toma de decisiones, como la recomendación de productos o la gestión de riesgos

En general, Q-Learning se aplica a problemas que involucran una interacción entre un agente y un entorno, donde el agente busca maximizar una recompensa o minimizar una penalización.

**Detalles Adicionales**: La elección de Q-Learning como algoritmo de aprendizaje por refuerzo depende de las características del problema, como la complejidad del entorno, la cantidad de estados y acciones posibles, y la naturaleza de la recompensa. En algunos casos, Q-Learning puede ser más efectivo que otros algoritmos de aprendizaje por refuerzo, como SARSA o Deep Q-Networks.

**Conclusión**: En resumen, Q-Learning es un algoritmo versátil que se aplica a una variedad de problemas de aprendizaje por refuerzo, y su elección depende de las características específicas del problema.","Q-Learning se aplica en: videojuegos (como Atari), navegación robótica, control de tráfico, sistemas de recomendación, trading financiero, optimización de recursos, gestión de inventarios, y cualquier problema de toma de decisiones secuencial con recompensas.",0.8421052631578947,0.8802057142212276,0.0,1.0
¿Qué es la política epsilon-greedy?,"['de los valores Q, de acuerdo con lo que el agente explora en cada iteración. La tabla al\nfinal sirve como referencia para que el agente pueda seleccionar la mejor acción\nbasada en los valores Q.\nFinalmente, es importante recalcar que en el Q-learning el agente trabaja con una\npolítica epsilon-greedy, mas esta política no tiene valores fijos, sino que al inicio el\nalgoritmo tiene un epsilon de 1 y con cada iteración este valor va disminuyendo hasta\nterminar en 0 o en un límite inferior como 0.01, si es que así se especifica de antemano\n(Matiisen, s.f.). Esto se debe a que como el algoritmo no tiene conocimiento de la\ndinámica del sistema al inicio, entonces necesita explorar mucho para conocer el\nentorno, pero conforme va conociendo más del entorno puede explotar cada vez más\ny no solo explorar.\nDespués de la breve introducción al Q-learning, ahora se procederá con un ejemplo\npráctico sobre dos agentes que interactúan en el entorno virtual ""Frozen Lake"" del', 'actions = []\n    while done==False:\n        #Se selecciona la acción con la política epsilon greedy\n        action = policy_e_greedy(current_state)\n        actions.append(action_names[action])\nQ(s,a)←Q(s,a)+α[r(s,a)+γmaxQ′(s′,a′)−Q(s,a)]\nIn [12]:\nIn [13]:', ""estado posible y las columnas las acciones posibles en cada estado. Esta se inicializa\ncon todos sus valores en cero y conforme el agente aprenda actualizará los valores de\ncada entrada.\nQ_table = np.zeros((env.observation_space.n,env.action_space.n ))\n#para visualizar la Q-table como un data frame\ndf=pd.DataFrame(data=Q_table, columns=['Izquierda', 'Abajo', 'Derecha', 'Arriba'])\ndf.index = [i+1 for i in range(len(df))]\ndf.columns.name = 'Estado'\ndf\nIn [5]:\nIn [6]:\nOut[6]:\nIn [7]:\nOut[7]:\nIn [8]:""]","**Resumen**: La política epsilon-greedy es una estrategia de exploración utilizada en Q-Learning que balancea la explotación de acciones conocidas y la exploración de nuevas acciones.

**Respuesta Principal**: En el contexto del Q-Learning, la política epsilon-greedy es una política de selección de acciones que el agente utiliza para decidir qué acción realizar en cada estado. Esta política se basa en la idea de que el agente necesita explorar el entorno para aprender, pero también necesita explotar las acciones que ya conoce para maximizar la recompensa.

La política epsilon-greedy funciona de la siguiente manera: en cada iteración, el agente selecciona una acción con una probabilidad epsilon (ε) de explorar una acción aleatoria, y con una probabilidad (1 - ε) de seleccionar la acción con el valor Q más alto. El valor de epsilon disminuye con cada iteración, lo que significa que el agente explora menos y explota más conforme va conociendo más del entorno.

En el ejemplo práctico proporcionado, se puede ver cómo se implementa la política epsilon-greedy en el código, donde se selecciona la acción con la política epsilon-greedy utilizando la función `policy_e_greedy(current_state)`.

**Detalles Adicionales**: Es importante destacar que la política epsilon-greedy es una forma de balancear la exploración y la explotación, lo que permite al agente aprender de la experiencia y maximizar la recompensa. Sin embargo, la elección del valor de epsilon es crucial, ya que un valor demasiado alto puede llevar a una exploración excesiva, mientras que un valor demasiado bajo puede llevar a una explotación prematura.

**Conclusión**: En resumen, la política epsilon-greedy es una estrategia fundamental en Q-Learning que permite al agente explorar y explotar el entorno de manera efectiva, lo que conduce a una mayor eficiencia en el aprendizaje y la toma de decisiones.",La política epsilon-greedy es una estrategia que balancea exploración y explotación. Con probabilidad (1-ε) elige la mejor acción conocida (explotación) y con probabilidad ε elige una acción aleatoria (exploración). ε típicamente decrece durante el entrenamiento desde ~1.0 hasta ~0.1.,1.0,0.8852515421368965,0.9999999999,1.0
¿Cómo se evalúa un agente Q-Learning?,"['1) Modificar el código en la etapa de entrenamiento para que corra \nsólo 20 episodio (n_episodes = 20) y correr todo el código que \nsigue. ¿Qué cambios observas en la tabla Q? ¿En la etapa de prueba \no testing el agente sí llega a la meta o qué pasa?\n2) ¿Cuáles son las diferencias en la conducta del agente de \nacciones aleatorias y el agente con el algoritmo de Q-learning?\nReferencias:\nAggarwal, R. (s. f.). Q-learning - Reinforcement Learning. Recuperado el 15 de\ndiciembre de 2022. https://miet.ac.in/assets/uploads/cs/Q%20Learning.pdf\nBrooker, R. (2020). OpenAI Gym: CartPole-v1 - Q-Learning [Youtube].\nhttps://www.youtube.com/watch?v=JNKvJEzuNsc&t=227s\nJang, B. Kim, M. Harerimana, G. y Kim, J.W. (2019). ""Q-Learning Algorithms: A\nComprehensive Classification and Applications,"". IEEE Access, vol. 7,133653-\n133667, doi: 10.1109/ACCESS.2019.2941229\nMatiisen, T. (s. f.). Q-learning [Presentación]. Recuperado el 15 de diciembre de', 'de los valores Q, de acuerdo con lo que el agente explora en cada iteración. La tabla al\nfinal sirve como referencia para que el agente pueda seleccionar la mejor acción\nbasada en los valores Q.\nFinalmente, es importante recalcar que en el Q-learning el agente trabaja con una\npolítica epsilon-greedy, mas esta política no tiene valores fijos, sino que al inicio el\nalgoritmo tiene un epsilon de 1 y con cada iteración este valor va disminuyendo hasta\nterminar en 0 o en un límite inferior como 0.01, si es que así se especifica de antemano\n(Matiisen, s.f.). Esto se debe a que como el algoritmo no tiene conocimiento de la\ndinámica del sistema al inicio, entonces necesita explorar mucho para conocer el\nentorno, pero conforme va conociendo más del entorno puede explotar cada vez más\ny no solo explorar.\nDespués de la breve introducción al Q-learning, ahora se procederá con un ejemplo\npráctico sobre dos agentes que interactúan en el entorno virtual ""Frozen Lake"" del', ""#se obtienen los resultados del ambiente por la acción elegida\n        obs, reward, done, _,_= env.step(action)\n        score += reward\n        #se transita al nuevo estado\n        current_state = obs\n    print('Episodio: {}\\n\\tAcciones: {}; Puntaje: {}'.format(e, actions, score))\nenv.close()\nEpisodio: 1\nAcciones: ['Abajo', 'Abajo', 'Abajo', 'Derecha', 'Derecha', 'Derecha']; Punt\naje: 1.0\nEpisodio: 2\nAcciones: ['Abajo', 'Abajo', 'Abajo', 'Derecha', 'Derecha', 'Derecha']; Punt\naje: 1.0\nEpisodio: 3\nAcciones: ['Abajo', 'Abajo', 'Abajo', 'Derecha', 'Derecha', 'Derecha']; Punt\naje: 1.0\nEpisodio: 4\nAcciones: ['Abajo', 'Abajo', 'Abajo', 'Derecha', 'Derecha', 'Derecha']; Punt\naje: 1.0\nEpisodio: 5\nAcciones: ['Abajo', 'Abajo', 'Abajo', 'Derecha', 'Derecha', 'Derecha']; Punt\naje: 1.0\nEjercicio:\n1) Modificar el código en la etapa de entrenamiento para que corra \nsólo 20 episodio (n_episodes = 20) y correr todo el código que \nsigue. ¿Qué cambios observas en la tabla Q? ¿En la etapa de prueba""]","**Resumen**: La evaluación de un agente Q-Learning se basa en su capacidad para aprender y mejorar su política de toma de decisiones a lo largo del tiempo.

**Respuesta Principal**:
La evaluación de un agente Q-Learning se realiza mediante la observación de su comportamiento en diferentes etapas, como la etapa de entrenamiento y la etapa de prueba. En la etapa de entrenamiento, el agente interactúa con el entorno y aprende a tomar decisiones basadas en la experiencia. En la etapa de prueba, el agente aplica lo que ha aprendido para alcanzar la meta.

En el caso del ejercicio proporcionado, al modificar el código para que corra solo 20 episodios en la etapa de entrenamiento, se observarán cambios en la tabla Q. La tabla Q es una representación de los valores Q, que indican la calidad de cada acción en cada estado. A medida que el agente explora y aprende, los valores Q se actualizan para reflejar la experiencia del agente.

En la etapa de prueba, el agente utiliza la tabla Q para seleccionar la mejor acción basada en los valores Q. Si el agente llega a la meta, se considera que ha aprendido efectivamente. En caso contrario, se puede ajustar la política epsilon-greedy o el número de episodios de entrenamiento para mejorar el rendimiento del agente.

**Detalles Adicionales**:
Es importante destacar que la evaluación de un agente Q-Learning también puede incluir métricas como la tasa de éxito, el tiempo de convergencia y la estabilidad de la política de toma de decisiones. Además, se pueden utilizar técnicas de visualización para representar la tabla Q y facilitar la comprensión del comportamiento del agente.

**Conclusión**:
En resumen, la evaluación de un agente Q-Learning se basa en su capacidad para aprender y mejorar su política de toma de decisiones a lo largo del tiempo. Al analizar el comportamiento del agente en diferentes etapas, se puede determinar si ha aprendido efectivamente y si es necesario ajustar la política epsilon-greedy o el número de episodios de entrenamiento.","Un agente Q-Learning se evalúa mediante: recompensa acumulada promedio por episodio, tasa de convergencia a la política óptima, estabilidad del aprendizaje, tiempo de entrenamiento requerido, y rendimiento comparado con otros algoritmos. También se usan métricas como la pérdida TD y la exploración efectiva.",0.8421052631578947,0.8975043828011171,0.0,1.0
