user_input,retrieved_contexts,response,reference,faithfulness,answer_relevancy,context_precision,context_recall
¿Qué es Q-Learning y cómo funciona?,"[""Q-learning en el ambiente del FrozenLake\nAlicia Muñiz Jiménez\nLa clave para resolver problemas de aprendizaje por refuerzo (RL) es encontrar la\npolítica óptima ( ) de la función de valor para el problema específico. El Q-learning es\nun algoritmo del tipo modelo libre del RL basado en valor y es un policy off-learner, es\ndecir, depende del ensayo y error para actualizar su experiencia y conocimiento del\nentorno, ya que tienen que aprender la dinámica del sistema a través de la experiencia\ny aprende el valor de la política óptima independientemente del tipo de acciones del\nagente, así como que las actualizaciones de la función de valor se basan en la ecuación\nde Bellman (Jang, Kim, Harerimana y Kim, 2019).\nSu Q proviene de quality (cualidad en inglés), ya que el Q-learning representa qué tan\nútil es una acción en ganar una recompensa a futuro (Shyalika, 2019). Es así que el Q-\nlearning estima la función  que es el valor esperado de hacer una acción 'a' en"", ""estado posible y las columnas las acciones posibles en cada estado. Esta se inicializa\ncon todos sus valores en cero y conforme el agente aprenda actualizará los valores de\ncada entrada.\nQ_table = np.zeros((env.observation_space.n,env.action_space.n ))\n#para visualizar la Q-table como un data frame\ndf=pd.DataFrame(data=Q_table, columns=['Izquierda', 'Abajo', 'Derecha', 'Arriba'])\ndf.index = [i+1 for i in range(len(df))]\ndf.columns.name = 'Estado'\ndf\nIn [5]:\nIn [6]:\nOut[6]:\nIn [7]:\nOut[7]:\nIn [8]:"", 'Francois-Lavet, V. Henderson, P. Islam, R. Bellemare, M. G. y Pineau, J. (2018).\nFoundations and Trends in Machine Learning, 11 (3-4).\nhttps://doi.org/10.1561/2200000071\nFarama Foundation. (2023). Frozen Lake. Gymnasium Documentation. Recuperado\nel 28 de marzo de 2023.\nhttps://gymnasium.farama.org/environments/toy_text/frozen_lake/\nShyalika, C. (2019). A Beginners Guide to Q-Learning. En Towards Data Science.\nRecuperado el 8 de diciembre de 2022. https://towardsdatascience.com/a-\nbeginners-guide-to-q-learning-c3e2a30a653c']","**Resumen**: Q-Learning es un algoritmo de aprendizaje por refuerzo (RL) que busca encontrar la política óptima para un problema específico. Funciona mediante ensayo y error, actualizando su experiencia y conocimiento del entorno para aprender la dinámica del sistema y el valor de la política óptima.

**Respuesta Principal**: El Q-Learning es un algoritmo del tipo modelo libre del RL basado en valor y es un policy off-learner. Esto significa que depende del ensayo y error para actualizar su experiencia y conocimiento del entorno, ya que tiene que aprender la dinámica del sistema a través de la experiencia y aprende el valor de la política óptima independientemente del tipo de acciones del agente.

El nombre ""Q"" proviene de ""quality"" (cualidad en inglés), ya que el Q-Learning representa qué tan útil es una acción en ganar una recompensa a futuro. El algoritmo estima la función Q, que es el valor esperado de hacer una acción 'a' en un estado posible. La función Q se inicializa con todos sus valores en cero y se actualiza conforme el agente aprende.

En el contexto del ambiente del FrozenLake, la función Q se representa como una tabla (Q-table) con dimensiones (env.observation_space.n, env.action_space.n), donde cada entrada representa el valor esperado de tomar una acción específica en un estado específico. La Q-table se puede visualizar como un DataFrame con columnas que representan las acciones posibles en cada estado.

**Detalles Adicionales**: El Q-Learning utiliza la ecuación de Bellman para actualizar la función de valor. Esta ecuación se basa en la idea de que el valor de un estado es igual al valor de la recompensa inmediata más el valor de la política óptima en el estado siguiente.

**Conclusión**: En resumen, el Q-Learning es un algoritmo de aprendizaje por refuerzo que busca encontrar la política óptima para un problema específico mediante ensayo y error. Funciona actualizando su experiencia y conocimiento del entorno para aprender la dinámica del sistema y el valor de la política óptima.","Q-Learning es un algoritmo de aprendizaje por refuerzo sin modelo que aprende la función de valor Q(s,a) que representa la recompensa esperada de tomar la acción 'a' en el estado 's' y seguir la política óptima. Funciona mediante la actualización iterativa de una tabla Q usando la ecuación Q(s,a) = Q(s,a) + α[r + γ max Q(s',a') - Q(s,a)].",1.0,0.9216810628791751,0.9999999999,1.0
¿Cuál es la ecuación de Bellman en Q-Learning?,"['1) Modificar el código en la etapa de entrenamiento para que corra \nsólo 20 episodio (n_episodes = 20) y correr todo el código que \nsigue. ¿Qué cambios observas en la tabla Q? ¿En la etapa de prueba \no testing el agente sí llega a la meta o qué pasa?\n2) ¿Cuáles son las diferencias en la conducta del agente de \nacciones aleatorias y el agente con el algoritmo de Q-learning?\nReferencias:\nAggarwal, R. (s. f.). Q-learning - Reinforcement Learning. Recuperado el 15 de\ndiciembre de 2022. https://miet.ac.in/assets/uploads/cs/Q%20Learning.pdf\nBrooker, R. (2020). OpenAI Gym: CartPole-v1 - Q-Learning [Youtube].\nhttps://www.youtube.com/watch?v=JNKvJEzuNsc&t=227s\nJang, B. Kim, M. Harerimana, G. y Kim, J.W. (2019). ""Q-Learning Algorithms: A\nComprehensive Classification and Applications,"". IEEE Access, vol. 7,133653-\n133667, doi: 10.1109/ACCESS.2019.2941229\nMatiisen, T. (s. f.). Q-learning [Presentación]. Recuperado el 15 de diciembre de', 'transitará.\nComo se puede apreciar en la ecuación anterior, el Q-learning usa el método de\ndiferencias temporales para la actualización o estimación de los valores Q, ya que sólo\ntoma en cuenta el estado actual y el siguiente estado para estimar los valores Q\n(Matiisen, s. f.). Por otro lado, cuando el Q-learning es ejecutado se crea lo que se llama\nuna tabla-Q, que es una matriz donde las filas normalmente representan cada estado\nposible y las columnas las acciones posibles en cada estado (Aggarwal, s.f. ). Por lo\ntanto, cada entrada de la matriz es un par estado-acción. La tabla siempre se inicializa\ncon todos los valores en 0 y se actualiza cada entrada con la ecuación de actualización\nπ∗\nQ(s,a)\nQ(s,a)\nQ(s,a)←Q(s,a)+α[r(s,a)+γmaxQ′(s′,a′)−Q(s,a)]\nr(s,a)\nγ\nα\nQ(s,a)\nmaxQ′(s′,a′)', 'Comprehensive Classification and Applications,"". IEEE Access, vol. 7,133653-\n133667, doi: 10.1109/ACCESS.2019.2941229\nMatiisen, T. (s. f.). Q-learning [Presentación]. Recuperado el 15 de diciembre de\n2022. https://courses.cs.ut.ee/MTAT.03.292/2014_spring/uploads/Main/Q-\nlearning.pdf']","**Resumen**: La ecuación de Bellman en Q-Learning se utiliza para actualizar los valores Q en la tabla Q.

**Respuesta Principal**: La ecuación de Bellman en Q-Learning se puede expresar como:

Q(s,a) ← Q(s,a) + α[r(s,a) + γmaxQ′(s′,a′) - Q(s,a)]

Donde:

* Q(s,a) es el valor Q actual para el estado s y la acción a
* α es la tasa de aprendizaje
* r(s,a) es la recompensa obtenida al tomar la acción a en el estado s
* γ es el factor de descuento
* maxQ′(s′,a′) es el valor Q máximo para el estado siguiente s′ y todas las acciones a′ posibles

Esta ecuación se utiliza para actualizar los valores Q en la tabla Q, que es una matriz donde las filas representan cada estado posible y las columnas las acciones posibles en cada estado. Cada entrada de la matriz es un par estado-acción.

**Detalles Adicionales**: La ecuación de Bellman se utiliza en el algoritmo de Q-Learning para actualizar los valores Q en función de la experiencia del agente. El agente aprende a tomar decisiones óptimas al actualizar los valores Q en función de las recompensas y los estados siguientes.

**Conclusión**: En resumen, la ecuación de Bellman es fundamental en Q-Learning, ya que permite al agente actualizar los valores Q y aprender a tomar decisiones óptimas en función de la experiencia.","La ecuación de Bellman en Q-Learning es: Q(s,a) = R(s,a) + γ * max[Q(s',a')] donde Q(s,a) es el valor Q del estado s y acción a, R(s,a) es la recompensa inmediata, γ es el factor de descuento, y max[Q(s',a')] es el máximo valor Q del siguiente estado s'.",1.0,0.8899600504844335,0.49999999995,1.0
¿Qué significa la tasa de aprendizaje en Q-Learning?,"[""Q-learning en el ambiente del FrozenLake\nAlicia Muñiz Jiménez\nLa clave para resolver problemas de aprendizaje por refuerzo (RL) es encontrar la\npolítica óptima ( ) de la función de valor para el problema específico. El Q-learning es\nun algoritmo del tipo modelo libre del RL basado en valor y es un policy off-learner, es\ndecir, depende del ensayo y error para actualizar su experiencia y conocimiento del\nentorno, ya que tienen que aprender la dinámica del sistema a través de la experiencia\ny aprende el valor de la política óptima independientemente del tipo de acciones del\nagente, así como que las actualizaciones de la función de valor se basan en la ecuación\nde Bellman (Jang, Kim, Harerimana y Kim, 2019).\nSu Q proviene de quality (cualidad en inglés), ya que el Q-learning representa qué tan\nútil es una acción en ganar una recompensa a futuro (Shyalika, 2019). Es así que el Q-\nlearning estima la función  que es el valor esperado de hacer una acción 'a' en"", 'Comprehensive Classification and Applications,"". IEEE Access, vol. 7,133653-\n133667, doi: 10.1109/ACCESS.2019.2941229\nMatiisen, T. (s. f.). Q-learning [Presentación]. Recuperado el 15 de diciembre de\n2022. https://courses.cs.ut.ee/MTAT.03.292/2014_spring/uploads/Main/Q-\nlearning.pdf', ""#se obtienen los resultados del ambiente por la acción elegida\n        obs, reward, done, _,_= env.step(action)\n        score += reward\n        #se transita al nuevo estado\n        current_state = obs\n    print('Episodio: {}\\n\\tAcciones: {}; Puntaje: {}'.format(e, actions, score))\nenv.close()\nEpisodio: 1\nAcciones: ['Abajo', 'Abajo', 'Abajo', 'Derecha', 'Derecha', 'Derecha']; Punt\naje: 1.0\nEpisodio: 2\nAcciones: ['Abajo', 'Abajo', 'Abajo', 'Derecha', 'Derecha', 'Derecha']; Punt\naje: 1.0\nEpisodio: 3\nAcciones: ['Abajo', 'Abajo', 'Abajo', 'Derecha', 'Derecha', 'Derecha']; Punt\naje: 1.0\nEpisodio: 4\nAcciones: ['Abajo', 'Abajo', 'Abajo', 'Derecha', 'Derecha', 'Derecha']; Punt\naje: 1.0\nEpisodio: 5\nAcciones: ['Abajo', 'Abajo', 'Abajo', 'Derecha', 'Derecha', 'Derecha']; Punt\naje: 1.0\nEjercicio:\n1) Modificar el código en la etapa de entrenamiento para que corra \nsólo 20 episodio (n_episodes = 20) y correr todo el código que \nsigue. ¿Qué cambios observas en la tabla Q? ¿En la etapa de prueba""]","**Resumen**: La tasa de aprendizaje en Q-Learning es un parámetro que controla la velocidad a la que el algoritmo aprende de sus experiencias.

**Respuesta Principal**: En el contexto del Q-Learning, la tasa de aprendizaje (también conocida como alpha, α) es un parámetro que determina la velocidad a la que el algoritmo actualiza sus estimaciones de la función de valor Q. En otras palabras, la tasa de aprendizaje controla la velocidad a la que el algoritmo aprende de sus experiencias y ajusta sus decisiones en función de las recompensas y castigos recibidos.

La tasa de aprendizaje se utiliza en la ecuación de actualización de Q, que se basa en la ecuación de Bellman. La ecuación de actualización de Q se puede expresar como:

Q(s, a) ← Q(s, a) + α[r + γmax(Q(s', a')) - Q(s, a)]

Donde α es la tasa de aprendizaje, r es la recompensa recibida, γ es el factor de descuento, s es el estado actual, a es la acción tomada, s' es el estado siguiente y a' es la acción siguiente.

Un valor alto de α significa que el algoritmo aprenderá rápidamente de sus experiencias, pero puede ser propenso a sobreajuste. Un valor bajo de α significa que el algoritmo aprenderá lentamente, pero será más estable.

En el contexto del ejercicio proporcionado, no se menciona explícitamente la tasa de aprendizaje. Sin embargo, es importante tener en cuenta que la tasa de aprendizaje es un parámetro importante en el Q-Learning y puede afectar el rendimiento del algoritmo.

**Detalles Adicionales**: La elección de la tasa de aprendizaje adecuada depende del problema específico y del entorno en el que se está trabajando. En general, se recomienda experimentar con diferentes valores de α para encontrar el que mejor se adapte al problema.

**Conclusión**: En resumen, la tasa de aprendizaje en Q-Learning es un parámetro crucial que controla la velocidad a la que el algoritmo aprende de sus experiencias. La elección adecuada de la tasa de aprendizaje es importante para el rendimiento del algoritmo.","La tasa de aprendizaje (α) en Q-Learning controla qué tan rápido el agente actualiza sus valores Q. Un valor alto (cerca de 1) hace que el agente aprenda rápidamente pero sea inestable, mientras que un valor bajo (cerca de 0) hace el aprendizaje más estable pero lento. Típicamente se usa α entre 0.1 y 0.5.",0.5714285714285714,0.8704220610892083,0.9999999999,0.25
¿Cuál es la diferencia entre exploración y explotación?,"[""útil es una acción en ganar una recompensa a futuro (Shyalika, 2019). Es así que el Q-\nlearning estima la función  que es el valor esperado de hacer una acción 'a' en\nun estado 's' para estimar la política óptima y la ecuación de actualización de los\nvalores  es la siguiente:\nDonde:\n = recompensa obtenida en ese estado dada una acción.\n = factor de descuento para el estado futuro (al que se transitará), su valor es fijo\ny puede tomar el rango de valores de [0,1].\n = parámetro de aprendizaje, no es fijo ya que al inicio comienza en 1 y con cada\niteración irá disminuyendo su valor hasta alcanzar el valor de 0 o un límite inferior\ndefinido de antemano (ej. 0.01).\n = valor Q del estado actual dada la acción a.\n = máxima futura recompensa esperada del estado nuevo al que se\ntransitará.\nComo se puede apreciar en la ecuación anterior, el Q-learning usa el método de\ndiferencias temporales para la actualización o estimación de los valores Q, ya que sólo"", 'y no solo explorar.\nDespués de la breve introducción al Q-learning, ahora se procederá con un ejemplo\npráctico sobre dos agentes que interactúan en el entorno virtual ""Frozen Lake"" del\ngimnasio OpenAI, esto para entender mejor el Q-learning y las diferencias que se\npueden observar al compararlo con un agente que tiene una política de elección de\ncomportamiento de acciones aleatorias.\nExplicación del ambiente\nLa documentación de la paquetería gymnasium describe las siguientes características\ndel ambiente Frozen Lake (Farama Foundation, 2023):\nEstado de acciones (4):\n0 = Izquierda\n1 = Abajo\n2 = Derecha\n3 = Arriba\nEspacio observacional (16): Se utilizará el ambiente de Frozen Lake con una\ncuadrícula de tamaño 4x4, por lo que el total de observaciones posibles (estados)\nson 16, como se puede ver en la imagen de abajo.\nRecompensas:\n+1 si el agente alcanza la meta.\n0 si el agente cae en algún hoyo en el hielo.\n0 si el agente pasa por estados donde hay hielo congelado.', ""a', 'Derecha', 'Derecha']\nEpisode 200\nPuntaje:1.0; Acciones:['Abajo', 'Abajo', 'Abajo', 'Derecha', 'Derecha', 'Der\necha']\nEpisode 300\nPuntaje:1.0; Acciones:['Abajo', 'Abajo', 'Abajo', 'Derecha', 'Derecha', 'Der\necha']\nEpisode 400\nPuntaje:1.0; Acciones:['Abajo', 'Abajo', 'Abajo', 'Derecha', 'Derecha', 'Der\necha']\nEpisode 500\nPuntaje:1.0; Acciones:['Izquierda', 'Abajo', 'Arriba', 'Abajo', 'Arriba', 'A\nbajo', 'Abajo', 'Abajo', 'Derecha', 'Derecha', 'Derecha']\nGraficación de los puntajes por episodio\nplt.plot(puntajes_ep,'.')\nplt.title('Scores en cada episodio')\nplt.xlabel('Episodio')\nplt.ylabel('Recompensa')\nplt.show()\nIn [14]:""]","**Resumen**: La exploración y explotación son dos conceptos fundamentales en el aprendizaje por refuerzo (RL), especialmente en el Q-Learning.

**Respuesta Principal**:
En el contexto del Q-Learning, la exploración y explotación se refieren a dos estrategias diferentes que un agente puede adoptar para interactuar con su entorno.

La **exploración** se refiere a la acción de probar diferentes acciones en un estado determinado para recopilar información sobre las posibles recompensas y transiciones de estado. En otras palabras, el agente explora el entorno para aprender sobre las consecuencias de sus acciones. La exploración es esencial en el Q-Learning porque permite al agente descubrir nuevas políticas óptimas y mejorar su comprensión del entorno.

Por otro lado, la **explotación** se refiere a la acción de elegir la acción que se considera óptima en un estado determinado, basada en la información recopilada durante la exploración. En otras palabras, el agente explota su conocimiento actual para maximizar la recompensa esperada. La explotación es importante en el Q-Learning porque permite al agente aprovechar al máximo su conocimiento actual y obtener la mayor recompensa posible.

En el ejemplo práctico del entorno ""Frozen Lake"", la exploración se refiere a la acción de probar diferentes acciones (como moverse hacia la izquierda, abajo, derecha o arriba) para recopilar información sobre las posibles recompensas y transiciones de estado. La explotación se refiere a la acción de elegir la acción que se considera óptima en un estado determinado, como moverse hacia la derecha para alcanzar la meta.

**Detalles Adicionales**: Es importante destacar que la exploración y explotación no son mutuamente excluyentes. De hecho, un agente puede adoptar una estrategia que combine ambas, como la epsilon-greedy, que explora con una probabilidad epsilon y explota con una probabilidad 1-epsilon.

**Conclusión**: En resumen, la exploración y explotación son dos conceptos fundamentales en el Q-Learning que se refieren a la acción de recopilar información sobre el entorno y elegir la acción óptima, respectivamente. Un agente debe equilibrar adecuadamente la exploración y explotación para aprender de manera efectiva y maximizar la recompensa esperada.",Exploración significa que el agente prueba acciones aleatorias para descubrir nuevas estrategias y evitar quedarse en óptimos locales. Explotación significa que el agente elige la mejor acción conocida basada en su experiencia actual. El balance entre ambas se maneja típicamente con estrategias como epsilon-greedy.,1.0,0.8173906279983146,0.0,0.6666666666666666
¿Cómo se actualiza la tabla Q?,"['transitará.\nComo se puede apreciar en la ecuación anterior, el Q-learning usa el método de\ndiferencias temporales para la actualización o estimación de los valores Q, ya que sólo\ntoma en cuenta el estado actual y el siguiente estado para estimar los valores Q\n(Matiisen, s. f.). Por otro lado, cuando el Q-learning es ejecutado se crea lo que se llama\nuna tabla-Q, que es una matriz donde las filas normalmente representan cada estado\nposible y las columnas las acciones posibles en cada estado (Aggarwal, s.f. ). Por lo\ntanto, cada entrada de la matriz es un par estado-acción. La tabla siempre se inicializa\ncon todos los valores en 0 y se actualiza cada entrada con la ecuación de actualización\nπ∗\nQ(s,a)\nQ(s,a)\nQ(s,a)←Q(s,a)+α[r(s,a)+γmaxQ′(s′,a′)−Q(s,a)]\nr(s,a)\nγ\nα\nQ(s,a)\nmaxQ′(s′,a′)', 'son 16, como se puede ver en la imagen de abajo.\nRecompensas:\n+1 si el agente alcanza la meta.\n0 si el agente cae en algún hoyo en el hielo.\n0 si el agente pasa por estados donde hay hielo congelado.\nUn ejemplo de la exploración que hace el agente se puede visualizar de la siguiente\nforma:', ""estado posible y las columnas las acciones posibles en cada estado. Esta se inicializa\ncon todos sus valores en cero y conforme el agente aprenda actualizará los valores de\ncada entrada.\nQ_table = np.zeros((env.observation_space.n,env.action_space.n ))\n#para visualizar la Q-table como un data frame\ndf=pd.DataFrame(data=Q_table, columns=['Izquierda', 'Abajo', 'Derecha', 'Arriba'])\ndf.index = [i+1 for i in range(len(df))]\ndf.columns.name = 'Estado'\ndf\nIn [5]:\nIn [6]:\nOut[6]:\nIn [7]:\nOut[7]:\nIn [8]:""]","**Resumen**: La tabla Q se actualiza utilizando la ecuación de actualización de Q-learning, que combina la recompensa actual con la estimación de la mejor acción futura.

**Respuesta Principal**: La tabla Q se actualiza utilizando la ecuación de actualización de Q-learning, que se muestra a continuación:

Q(s,a) ← Q(s,a) + α[r(s,a) + γmaxQ′(s′,a′) - Q(s,a)]

Donde:

* Q(s,a) es el valor Q actual para el estado s y la acción a
* α es la tasa de aprendizaje, que controla la velocidad a la que se aprende
* r(s,a) es la recompensa obtenida al tomar la acción a en el estado s
* γ es el factor de descuento, que determina la importancia de las recompensas futuras
* maxQ′(s′,a′) es la estimación de la mejor acción futura en el estado s′

La tabla Q se inicializa con todos los valores en 0 y se actualiza cada entrada con la ecuación de actualización anterior. Esto permite al agente aprender a tomar decisiones óptimas en función de las recompensas y los estados.

**Detalles Adicionales**: En el contexto proporcionado, la tabla Q se inicializa con la siguiente instrucción: `Q_table = np.zeros((env.observation_space.n, env.action_space.n))`. Luego, se puede visualizar como un DataFrame para facilitar la comprensión.

**Conclusión**: En resumen, la tabla Q se actualiza utilizando la ecuación de actualización de Q-learning, que combina la recompensa actual con la estimación de la mejor acción futura. Esto permite al agente aprender a tomar decisiones óptimas en función de las recompensas y los estados.","La tabla Q se actualiza usando la regla: Q(s,a) = Q(s,a) + α[r + γ max Q(s',a') - Q(s,a)] donde α es la tasa de aprendizaje, r es la recompensa recibida, γ es el factor de descuento, y el término entre corchetes es el error temporal difference (TD).",1.0,0.8589091619542616,0.9999999999,1.0
